{"schema_version": 1, "atlas_id": "tokyo", "release_id": "shinjuku-source-v1", "origin_lonlat": [139.6917, 35.6896], "camera_target_enu": [0.0, 0.0, 120.08777160644532], "camera_offset_enu": [1500.0, -1500.0, 1500.0], "pixel_origin": [1200.0, 1200.0], "pixels_per_metre": 1.9047619047619047, "bounds_px": [0, 0, 2400, 2400], "source_bounds_wsen": [139.67688, 35.67835, 139.70549, 35.70169], "chunk_size_px": 800, "overscan_px": 32, "vertical_range_enu_m": [-100.0, 650.0], "shadow_buffer_m": 600.0, "render_samples": 32, "render_seed": 0}